PROCEDIMENTO,RN (ALTERACAO),VIGÊNCIA,OD,AMB,HCO,HSO,REF,PAC,DUT,SUBGRUPO,GRUPO,CAPITULO
ACONSELHAMENTO GENÉTICO,SEM VALOR,SEM VALOR,SEM VALOR,Seg. Ambulatorial,HCO,HSO,REF,SEM VALOR,SEM VALOR,"CONSULTAS, VISITAS HOSPITALARES OU ACOMPANHAMENTO DE PACIENTES",PROCEDIMENTOS GERAIS,PROCEDIMENTOS GERAIS
ATENDIMENTO/ACOMPANHAMENTO EM HOSPITAL-DIA PSIQUIÁTRICO (COM DIRETRIZ DE UTILIZAÇÃO),SEM VALOR,SEM VALOR,SEM VALOR,SEM VALOR,HCO,HSO,REF,SEM VALOR,109,"CONSULTAS, VISITAS HOSPITALARES OU ACOMPANHAMENTO DE PACIENTES",PROCEDIMENTOS GERAIS,PROCEDIMENTOS GERAIS
"ATENDIMENTO INTEGRAL AO RECÉM-NASCIDO (SALA DE PARTO, BERÇÁRIO E UTI)",SEM VALOR,SEM VALOR,SEM VALOR,SEM VALOR,HCO,SEM VALOR,REF,SEM VALOR,SEM VALOR,"CONSULTAS, VISITAS HOSPITALARES OU ACOMPANHAMENTO DE PACIENTES",PROCEDIMENTOS GERAIS,PROCEDIMENTOS GERAIS
ATENDIMENTO MÉDICO DO INTENSIVISTA EM UTI GERAL OU PEDIÁTRICA,SEM VALOR,SEM VALOR,SEM VALOR,SEM VALOR,HCO,HSO,REF,SEM VALOR,SEM VALOR,"CONSULTAS, VISITAS HOSPITALARES OU ACOMPANHAMENTO DE PACIENTES",PROCEDIMENTOS GERAIS,PROCEDIMENTOS GERAIS
ATENDIMENTO PEDIÁTRICO A GESTANTES (3º TRIMESTRE),SEM VALOR,SEM VALOR,SEM VALOR,Seg. Ambulatorial,HCO,SEM VALOR,REF,SEM VALOR,SEM VALOR,"CONSULTAS, VISITAS HOSPITALARES OU ACOMPANHAMENTO DE PACIENTES",PROCEDIMENTOS GERAIS,PROCEDIMENTOS GERAIS
ATIVIDADE EDUCACIONAL PARA PLANEJAMENTO FAMILIAR,SEM VALOR,SEM VALOR,SEM VALOR,Seg. Ambulatorial,SEM VALOR,SEM VALOR,REF,SEM VALOR,SEM VALOR,"CONSULTAS, VISITAS HOSPITALARES OU ACOMPANHAMENTO DE PACIENTES",PROCEDIMENTOS GERAIS,PROCEDIMENTOS GERAIS
ATIVIDADE EDUCATIVA EM SAÚDE BUCAL,SEM VALOR,SEM VALOR,Seg. Odontológica,SEM VALOR,SEM VALOR,SEM VALOR,SEM VALOR,SEM VALOR,SEM VALOR,"CONSULTAS, VISITAS HOSPITALARES OU ACOMPANHAMENTO DE PACIENTES",PROCEDIMENTOS GERAIS,PROCEDIMENTOS GERAIS
ATIVIDADE EDUCATIVA EM ODONTOLOGIA PARA PAIS E/OU CUIDADORES DE PACIENTES COM NECESSIDADES ESPECIAIS,SEM VALOR,SEM VALOR,Seg. Odontológica,SEM VALOR,SEM VALOR,SEM VALOR,SEM VALOR,SEM VALOR,SEM VALOR,"CONSULTAS, VISITAS HOSPITALARES OU ACOMPANHAMENTO DE PACIENTES",PROCEDIMENTOS GERAIS,PROCEDIMENTOS GERAIS
CONDICIONAMENTO EM ODONTOLOGIA (COM DIRETRIZ DE UTILIZAÇÃO),SEM VALOR,SEM VALOR,Seg. Odontológica,SEM VALOR,SEM VALOR,SEM VALOR,SEM VALOR,SEM VALOR,86,"CONSULTAS, VISITAS HOSPITALARES OU ACOMPANHAMENTO DE PACIENTES",PROCEDIMENTOS GERAIS,PROCEDIMENTOS GERAIS
ESTABILIZAÇÃO DE PACIENTE POR MEIO DE CONTENÇÃO FÍSICA E/OU MECÂNICA,SEM VALOR,SEM VALOR,Seg. Odontológica,SEM VALOR,SEM VALOR,SEM VALOR,SEM VALOR,SEM VALOR,SEM VALOR,"CONSULTAS, VISITAS HOSPITALARES OU ACOMPANHAMENTO DE PACIENTES",PROCEDIMENTOS GERAIS,PROCEDIMENTOS GERAIS
CONSULTA DE ACONSELHAMENTO PARA PLANEJAMENTO FAMILIAR,SEM VALOR,SEM VALOR,SEM VALOR,Seg. Ambulatorial,SEM VALOR,SEM VALOR,REF,SEM VALOR,SEM VALOR,"CONSULTAS, VISITAS HOSPITALARES OU ACOMPANHAMENTO DE PACIENTES",PROCEDIMENTOS GERAIS,PROCEDIMENTOS GERAIS
CONSULTA COM ENFERMEIRO OBSTETRA OU OBSTETRIZ (COM DIRETRIZ DE UTILIZAÇÃO),SEM VALOR,SEM VALOR,SEM VALOR,Seg. Ambulatorial,HCO,SEM VALOR,REF,SEM VALOR,135,"CONSULTAS, VISITAS HOSPITALARES OU ACOMPANHAMENTO DE PACIENTES",PROCEDIMENTOS GERAIS,PROCEDIMENTOS GERAIS
CONSULTA/AVALIAÇÃO COM FISIOTERAPEUTA,541/2022,01/08/2022,SEM VALOR,Seg. Ambulatorial,SEM VALOR,SEM VALOR,REF,SEM VALOR,SEM VALOR,"CONSULTAS, VISITAS HOSPITALARES OU ACOMPANHAMENTO DE PACIENTES",PROCEDIMENTOS GERAIS,PROCEDIMENTOS GERAIS
CONSULTA MÉDICA,SEM VALOR,SEM VALOR,SEM VALOR,Seg. Ambulatorial,SEM VALOR,SEM VALOR,REF,SEM VALOR,SEM VALOR,"CONSULTAS, VISITAS HOSPITALARES OU ACOMPANHAMENTO DE PACIENTES",PROCEDIMENTOS GERAIS,PROCEDIMENTOS GERAIS
CONSULTA ODONTOLÓGICA,SEM VALOR,SEM VALOR,Seg. Odontológica,SEM VALOR,SEM VALOR,SEM VALOR,SEM VALOR,SEM VALOR,SEM VALOR,"CONSULTAS, VISITAS HOSPITALARES OU ACOMPANHAMENTO DE PACIENTES",PROCEDIMENTOS GERAIS,PROCEDIMENTOS GERAIS
CONSULTA ODONTOLÓGICA INICIAL,SEM VALOR,SEM VALOR,Seg. Odontológica,SEM VALOR,SEM VALOR,SEM VALOR,SEM VALOR,SEM VALOR,SEM VALOR,"CONSULTAS, VISITAS HOSPITALARES OU ACOMPANHAMENTO DE PACIENTES",PROCEDIMENTOS GERAIS,PROCEDIMENTOS GERAIS
CONSULTA ODONTOLÓGICA DE URGÊNCIA,SEM VALOR,SEM VALOR,Seg. Odontológica,SEM VALOR,SEM VALOR,SEM VALOR,SEM VALOR,SEM VALOR,SEM VALOR,"CONSULTAS, VISITAS HOSPITALARES OU ACOMPANHAMENTO DE PACIENTES",PROCEDIMENTOS GERAIS,PROCEDIMENTOS GERAIS
CONSULTA ODONTOLÓGICA PARA AVALIAÇÃO TÉCNICA DE AUDITORIA,SEM VALOR,SEM VALOR,Seg. Odontológica,SEM VALOR,SEM VALOR,SEM VALOR,SEM VALOR,SEM VALOR,SEM VALOR,"CONSULTAS, VISITAS HOSPITALARES OU ACOMPANHAMENTO DE PACIENTES",PROCEDIMENTOS GERAIS,PROCEDIMENTOS GERAIS
CONSULTA/AVALIAÇÃO COM PSICÓLOGO,541/2022,01/08/2022,SEM VALOR,Seg. Ambulatorial,SEM VALOR,SEM VALOR,REF,SEM VALOR,SEM VALOR,"CONSULTAS, VISITAS HOSPITALARES OU ACOMPANHAMENTO DE PACIENTES",PROCEDIMENTOS GERAIS,PROCEDIMENTOS GERAIS
PROCEDIMENTO,RN (alteração),VIGÊNCIA,Seg. Odontológica,Seg. Ambulatorial,HCO,HSO,REF,PAC,DUT,SUBGRUPO,GRUPO,CAPÍTULO
SESSÃO COM PSICÓLOGO,541/2022,01/08/2022,SEM VALOR,Seg. Ambulatorial,SEM VALOR,SEM VALOR,REF,SEM VALOR,SEM VALOR,"CONSULTAS, VISITAS HOSPITALARES OU ACOMPANHAMENTO DE PACIENTES",PROCEDIMENTOS GERAIS,PROCEDIMENTOS GERAIS
CONSULTA/AVALIAÇÃO COM FONOAUDIÓLOGO,541/2022,01/08/2022,SEM VALOR,Seg. Ambulatorial,SEM VALOR,SEM VALOR,REF,SEM VALOR,SEM VALOR,"CONSULTAS, VISITAS HOSPITALARES OU ACOMPANHAMENTO DE PACIENTES",PROCEDIMENTOS GERAIS,PROCEDIMENTOS GERAIS
SESSÃO COM FONOAUDIÓLOGO,541/2022,01/08/2022,SEM VALOR,Seg. Ambulatorial,SEM VALOR,SEM VALOR,REF,SEM VALOR,SEM VALOR,"CONSULTAS, VISITAS HOSPITALARES OU ACOMPANHAMENTO DE PACIENTES",PROCEDIMENTOS GERAIS,PROCEDIMENTOS GERAIS
CONSULTA COM NUTRICIONISTA (COM DIRETRIZ DE UTILIZAÇÃO),SEM VALOR,SEM VALOR,SEM VALOR,Seg. Ambulatorial,SEM VALOR,SEM VALOR,REF,SEM VALOR,103,"CONSULTAS, VISITAS HOSPITALARES OU ACOMPANHAMENTO DE PACIENTES",PROCEDIMENTOS GERAIS,PROCEDIMENTOS GERAIS
CONSULTA/AVALIAÇÃO COM TERAPEUTA OCUPACIONAL,541/2022,01/08/2022,SEM VALOR,Seg. Ambulatorial,SEM VALOR,SEM VALOR,REF,SEM VALOR,SEM VALOR,"CONSULTAS, VISITAS HOSPITALARES OU ACOMPANHAMENTO DE PACIENTES",PROCEDIMENTOS GERAIS,PROCEDIMENTOS GERAIS
SESSÃO COM TERAPEUTA OCUPACIONAL,541/2022,01/08/2022,SEM VALOR,Seg. Ambulatorial,SEM VALOR,SEM VALOR,REF,SEM VALOR,SEM VALOR,"CONSULTAS, VISITAS HOSPITALARES OU ACOMPANHAMENTO DE PACIENTES",PROCEDIMENTOS GERAIS,PROCEDIMENTOS GERAIS
"TRANSPORTE EXTRA-HOSPITALAR DE PACIENTES GRAVES COM ACOMPANHAMENTO MÉDICO, DO ESTABELECIMENTO HOSPITALAR DE ORIGEM PARA OUTRO ESTABELECIMENTO DE SAÚDE",SEM VALOR,SEM VALOR,SEM VALOR,SEM VALOR,HCO,HSO,REF,SEM VALOR,SEM VALOR,"CONSULTAS, VISITAS HOSPITALARES OU ACOMPANHAMENTO DE PACIENTES",PROCEDIMENTOS GERAIS,PROCEDIMENTOS GERAIS
VISITA HOSPITALAR,SEM VALOR,SEM VALOR,SEM VALOR,SEM VALOR,HCO,HSO,REF,SEM VALOR,SEM VALOR,"CONSULTAS, VISITAS HOSPITALARES OU ACOMPANHAMENTO DE PACIENTES",PROCEDIMENTOS GERAIS,PROCEDIMENTOS GERAIS
ACOMPANHAMENTO CLÍNICO AMBULATORIAL PÓS-TRANSPLANTE DE CÓRNEA,SEM VALOR,SEM VALOR,SEM VALOR,SEM VALOR,HCO,HSO,REF,SEM VALOR,SEM VALOR,AVALIAÇÕES/ACOMPANHAMENTOS,PROCEDIMENTOS CLÍNICOS AMBULATORIAIS E HOSPITALARES,PROCEDIMENTOS CLÍNICOS AMBULATORIAIS E HOSPITALARES
ACOMPANHAMENTO CLÍNICO AMBULATORIAL PÓS-TRANSPLANTE DE MEDULA ÓSSEA,SEM VALOR,SEM VALOR,SEM VALOR,SEM VALOR,HCO,HSO,REF,SEM VALOR,SEM VALOR,AVALIAÇÕES/ACOMPANHAMENTOS,PROCEDIMENTOS CLÍNICOS AMBULATORIAIS E HOSPITALARES,PROCEDIMENTOS CLÍNICOS AMBULATORIAIS E HOSPITALARES
ACOMPANHAMENTO CLÍNICO AMBULATORIAL PÓS-TRANSPLANTE HEPÁTICO,546/2022,03/10/2022,SEM VALOR,SEM VALOR,HCO,HSO,REF,SEM VALOR,SEM VALOR,AVALIAÇÕES/ACOMPANHAMENTOS,PROCEDIMENTOS CLÍNICOS AMBULATORIAIS E HOSPITALARES,PROCEDIMENTOS CLÍNICOS AMBULATORIAIS E HOSPITALARES
ACOMPANHAMENTO CLÍNICO AMBULATORIAL PÓS-TRANSPLANTE RENAL,SEM VALOR,SEM VALOR,SEM VALOR,SEM VALOR,HCO,HSO,REF,SEM VALOR,SEM VALOR,AVALIAÇÕES/ACOMPANHAMENTOS,PROCEDIMENTOS CLÍNICOS AMBULATORIAIS E HOSPITALARES,PROCEDIMENTOS CLÍNICOS AMBULATORIAIS E HOSPITALARES
ACOMPANHAMENTO CLÍNICO DE TRANSPLANTE HEPÁTICO NO PERÍODO DE INTERNAÇÃO DO RECEPTOR E DO DOADOR,546/2022,03/10/2022,SEM VALOR,SEM VALOR,HCO,HSO,REF,PAC,SEM VALOR,AVALIAÇÕES/ACOMPANHAMENTOS,PROCEDIMENTOS CLÍNICOS AMBULATORIAIS E HOSPITALARES,PROCEDIMENTOS CLÍNICOS AMBULATORIAIS E HOSPITALARES
ACOMPANHAMENTO CLÍNICO DE TRANSPLANTE RENAL NO PERÍODO DE INTERNAÇÃO DO RECEPTOR E DO DOADOR,SEM VALOR,SEM VALOR,SEM VALOR,SEM VALOR,HCO,HSO,REF,PAC,SEM VALOR,AVALIAÇÕES/ACOMPANHAMENTOS,PROCEDIMENTOS CLÍNICOS AMBULATORIAIS E HOSPITALARES,PROCEDIMENTOS CLÍNICOS AMBULATORIAIS E HOSPITALARES
AVALIAÇÃO CLÍNICA DIARIA ENTERAL E/OU PARENTERAL,SEM VALOR,SEM VALOR,SEM VALOR,SEM VALOR,HCO,HSO,REF,SEM VALOR,SEM VALOR,AVALIAÇÕES/ACOMPANHAMENTOS,PROCEDIMENTOS CLÍNICOS AMBULATORIAIS E HOSPITALARES,PROCEDIMENTOS CLÍNICOS AMBULATORIAIS E HOSPITALARES
"AVALIAÇÃO CLÍNICA E ELETRÔNICA DE PACIENTE PORTADOR DE DISPOSITIVO CARDÍACO ELETRÔNICO IMPLANTÁVEL (MARCA-PASSO, ESTIMULADOR MULTISSÍTIO/RESSINCRONIZADOR, DESFIBRILADOR OU MONITOR DE EVENTOS)",SEM VALOR,SEM VALOR,SEM VALOR,Seg. Ambulatorial,HCO,HSO,REF,SEM VALOR,SEM VALOR,AVALIAÇÕES/ACOMPANHAMENTOS,PROCEDIMENTOS CLÍNICOS AMBULATORIAIS E HOSPITALARES,PROCEDIMENTOS CLÍNICOS AMBULATORIAIS E HOSPITALARES
CARDIOVERSÃO ELÉTRICA COM ELETROCARDIOGRAMA,SEM VALOR,SEM VALOR,SEM VALOR,Seg. Ambulatorial,HCO,HSO,REF,SEM VALOR,SEM VALOR,AVALIAÇÕES/ACOMPANHAMENTOS,PROCEDIMENTOS CLÍNICOS AMBULATORIAIS E HOSPITALARES,PROCEDIMENTOS CLÍNICOS AMBULATORIAIS E HOSPITALARES
CONTROLE DE BIOFILME DENTAL (PLACA BACTERIANA),SEM VALOR,SEM VALOR,Seg. Odontológica,SEM VALOR,SEM VALOR,SEM VALOR,SEM VALOR,SEM VALOR,SEM VALOR,AVALIAÇÕES/ACOMPANHAMENTOS,PROCEDIMENTOS CLÍNICOS AMBULATORIAIS E HOSPITALARES,PROCEDIMENTOS CLÍNICOS AMBULATORIAIS E HOSPITALARES
"FORNECIMENTO DE EQUIPAMENTOS COLETORES E ADJUVANTES PARA COLOSTOMIA, ILEOSTOMIA E UROSTOMIA, SONDA VESICAL DE DEMORA E COLETOR DE URINA (COM PROTOCOLO DE UTILIZAÇÃO - PROUT)",SEM VALOR,SEM VALOR,SEM VALOR,Seg. Ambulatorial,HCO,HSO,REF,SEM VALOR,SEM VALOR,AVALIAÇÕES/ACOMPANHAMENTOS,PROCEDIMENTOS CLÍNICOS AMBULATORIAIS E HOSPITALARES,PROCEDIMENTOS CLÍNICOS AMBULATORIAIS E HOSPITALARES
PROCEDIMENTO,RN (alteração),VIGÊNCIA,Seg. Odontológica,Seg. Ambulatorial,HCO,HSO,REF,PAC,DUT,SUBGRUPO,GRUPO,CAPÍTULO
PROFILAXIA: POLIMENTO CORONÁRIO,SEM VALOR,SEM VALOR,Seg. Odontológica,SEM VALOR,SEM VALOR,SEM VALOR,SEM VALOR,SEM VALOR,SEM VALOR,AVALIAÇÕES/ACOMPANHAMENTOS,PROCEDIMENTOS CLÍNICOS AMBULATORIAIS E HOSPITALARES,PROCEDIMENTOS CLÍNICOS AMBULATORIAIS E HOSPITALARES
TERAPIA ANTINEOPLÁSICA ORAL PARA TRATAMENTO DO CÂNCER (COM DIRETRIZ DE UTILIZAÇÃO),SEM VALOR,SEM VALOR,SEM VALOR,Seg. Ambulatorial,HCO,HSO,REF,PAC,64,AVALIAÇÕES/ACOMPANHAMENTOS,PROCEDIMENTOS CLÍNICOS AMBULATORIAIS E HOSPITALARES,PROCEDIMENTOS CLÍNICOS AMBULATORIAIS E HOSPITALARES
TESTE DE PROVOCAÇÃO ORAL COM ALIMENTOS (COM DIRETRIZ DE UTILIZAÇÃO),536/2022,06/05/2022,SEM VALOR,Seg. Ambulatorial,HCO,HSO,REF,SEM VALOR,152,AVALIAÇÕES/ACOMPANHAMENTOS,PROCEDIMENTOS CLÍNICOS AMBULATORIAIS E HOSPITALARES,PROCEDIMENTOS CLÍNICOS AMBULATORIAIS E HOSPITALARES
MEDICAMENTOS PARA O CONTROLE DE EFEITOS ADVERSOS E ADJUVANTES RELACIONADOS A TRATAMENTOS ANTINEOPLÁSICOS (COM DIRETRIZ DE UTILIZAÇÃO),SEM VALOR,SEM VALOR,SEM VALOR,Seg. Ambulatorial,SEM VALOR,SEM VALOR,REF,PAC,54,AVALIAÇÕES/ACOMPANHAMENTOS,PROCEDIMENTOS CLÍNICOS AMBULATORIAIS E HOSPITALARES,PROCEDIMENTOS CLÍNICOS AMBULATORIAIS E HOSPITALARES
CARDIOTOCOGRAFIA,SEM VALOR,SEM VALOR,SEM VALOR,Seg. Ambulatorial,HCO,HSO,REF,SEM VALOR,SEM VALOR,MONITORIZAÇÕES,PROCEDIMENTOS CLÍNICOS AMBULATORIAIS E HOSPITALARES,PROCEDIMENTOS CLÍNICOS AMBULATORIAIS E HOSPITALARES
HOLTER DE 24 HORAS - 2 OU MAIS CANAIS - ANALÓGICO OU DIGITAL,SEM VALOR,SEM VALOR,SEM VALOR,Seg. Ambulatorial,SEM VALOR,SEM VALOR,REF,SEM VALOR,SEM VALOR,MONITORIZAÇÕES,PROCEDIMENTOS CLÍNICOS AMBULATORIAIS E HOSPITALARES,PROCEDIMENTOS CLÍNICOS AMBULATORIAIS E HOSPITALARES
MONITORIZAÇÃO AMBULATORIAL DA PRESSÃO ARTERIAL - MAPA (24 HORAS) - COM DIRETRIZ DE UTILIZAÇÃO,SEM VALOR,SEM VALOR,SEM VALOR,Seg. Ambulatorial,SEM VALOR,SEM VALOR,REF,SEM VALOR,56,MONITORIZAÇÕES,PROCEDIMENTOS CLÍNICOS AMBULATORIAIS E HOSPITALARES,PROCEDIMENTOS CLÍNICOS AMBULATORIAIS E HOSPITALARES
MONITORIZAÇÃO AMBULATORIAL DA PRESSÃO ARTERIAL DE 5 DIAS - MAPA 5 DIAS (MONITORIZAÇÃO RESIDENCIAL DA PRESSÃO ARTERIAL - MRPA) - COM DIRETRIZ DE UTILIZAÇÂO,581/2023,12/072023,SEM VALOR,Seg. Ambulatorial,SEM VALOR,SEM VALOR,REF,SEM VALOR,162,MONITORIZAÇÕES,PROCEDIMENTOS CLÍNICOS AMBULATORIAIS E HOSPITALARES,PROCEDIMENTOS CLÍNICOS AMBULATORIAIS E HOSPITALARES
MONITORIZAÇÃO DA PRESSÃO INTRACRANIANA,SEM VALOR,SEM VALOR,SEM VALOR,SEM VALOR,HCO,HSO,REF,SEM VALOR,SEM VALOR,MONITORIZAÇÕES,PROCEDIMENTOS CLÍNICOS AMBULATORIAIS E HOSPITALARES,PROCEDIMENTOS CLÍNICOS AMBULATORIAIS E HOSPITALARES
MONITORIZAÇÃO HEMODINÂMICA INVASIVA OU NÃO INVASIVA,SEM VALOR,SEM VALOR,SEM VALOR,SEM VALOR,HCO,HSO,REF,SEM VALOR,SEM VALOR,MONITORIZAÇÕES,PROCEDIMENTOS CLÍNICOS AMBULATORIAIS E HOSPITALARES,PROCEDIMENTOS CLÍNICOS AMBULATORIAIS E HOSPITALARES
MONITORIZAÇÃO NEUROFISIOLÓGICA INTRA-OPERATÓRIA,SEM VALOR,SEM VALOR,SEM VALOR,SEM VALOR,HCO,HSO,REF,SEM VALOR,SEM VALOR,MONITORIZAÇÕES,PROCEDIMENTOS CLÍNICOS AMBULATORIAIS E HOSPITALARES,PROCEDIMENTOS CLÍNICOS AMBULATORIAIS E HOSPITALARES
POTENCIAL EVOCADO INTRA-OPERATÓRIO - MONITORIZAÇÃO CIRÚRGICA (PE/IO),SEM VALOR,SEM VALOR,SEM VALOR,SEM VALOR,HCO,HSO,REF,SEM VALOR,SEM VALOR,MONITORIZAÇÕES,PROCEDIMENTOS CLÍNICOS AMBULATORIAIS E HOSPITALARES,PROCEDIMENTOS CLÍNICOS AMBULATORIAIS E HOSPITALARES
TESTE DE INCLINAÇÃO ORTOSTÁTICA (TILT TEST) - COM DIRETRIZ DE UTILIZAÇÃO,SEM VALOR,SEM VALOR,SEM VALOR,Seg. Ambulatorial,HCO,HSO,REF,PAC,67,MONITORIZAÇÕES,PROCEDIMENTOS CLÍNICOS AMBULATORIAIS E HOSPITALARES,PROCEDIMENTOS CLÍNICOS AMBULATORIAIS E HOSPITALARES
ADAPTAÇÃO E TREINAMENTO DE RECURSOS ÓPTICOS,SEM VALOR,SEM VALOR,SEM VALOR,Seg. Ambulatorial,SEM VALOR,SEM VALOR,REF,SEM VALOR,SEM VALOR,REABILITAÇÃO,PROCEDIMENTOS CLÍNICOS AMBULATORIAIS E HOSPITALARES,PROCEDIMENTOS CLÍNICOS AMBULATORIAIS E HOSPITALARES
AMPUTAÇÃO (PREPARAÇÃO DO COTO E TREINAMENTO PROTÉTICO),SEM VALOR,SEM VALOR,SEM VALOR,Seg. Ambulatorial,HCO,HSO,REF,SEM VALOR,SEM VALOR,REABILITAÇÃO,PROCEDIMENTOS CLÍNICOS AMBULATORIAIS E HOSPITALARES,PROCEDIMENTOS CLÍNICOS AMBULATORIAIS E HOSPITALARES
BIOFEEDBACK COM EMG,SEM VALOR,SEM VALOR,SEM VALOR,Seg. Ambulatorial,HCO,HSO,REF,SEM VALOR,SEM VALOR,REABILITAÇÃO,PROCEDIMENTOS CLÍNICOS AMBULATORIAIS E HOSPITALARES,PROCEDIMENTOS CLÍNICOS AMBULATORIAIS E HOSPITALARES
EXERCÍCIOS DE ORTÓPTICA,SEM VALOR,SEM VALOR,SEM VALOR,Seg. Ambulatorial,SEM VALOR,SEM VALOR,REF,SEM VALOR,SEM VALOR,REABILITAÇÃO,PROCEDIMENTOS CLÍNICOS AMBULATORIAIS E HOSPITALARES,PROCEDIMENTOS CLÍNICOS AMBULATORIAIS E HOSPITALARES
INFILTRAÇÃO DE PONTO GATILHO OU AGULHAMENTO SECO,SEM VALOR,SEM VALOR,SEM VALOR,Seg. Ambulatorial,HCO,HSO,REF,SEM VALOR,SEM VALOR,REABILITAÇÃO,PROCEDIMENTOS CLÍNICOS AMBULATORIAIS E HOSPITALARES,PROCEDIMENTOS CLÍNICOS AMBULATORIAIS E HOSPITALARES
REABILITACAO E REEDUCACAO DE SEQÜELAS EM TRAUMATISMOS E POLITRAUMATIZADOS,SEM VALOR,SEM VALOR,SEM VALOR,Seg. Ambulatorial,HCO,HSO,REF,SEM VALOR,SEM VALOR,REABILITAÇÃO,PROCEDIMENTOS CLÍNICOS AMBULATORIAIS E HOSPITALARES,PROCEDIMENTOS CLÍNICOS AMBULATORIAIS E HOSPITALARES
PROCEDIMENTO,RN (alteração),VIGÊNCIA,Seg. Odontológica,Seg. Ambulatorial,HCO,HSO,REF,PAC,DUT,SUBGRUPO,GRUPO,CAPÍTULO
REABILITAÇÃO LABIRÍNTICA,SEM VALOR,SEM VALOR,SEM VALOR,Seg. Ambulatorial,HCO,HSO,REF,SEM VALOR,SEM VALOR,REABILITAÇÃO,PROCEDIMENTOS CLÍNICOS AMBULATORIAIS E HOSPITALARES,PROCEDIMENTOS CLÍNICOS AMBULATORIAIS E HOSPITALARES
REABILITAÇÃO PERINEAL/VESICO-URETRAL COM OU SEM BIOFEEDBACK,SEM VALOR,SEM VALOR,SEM VALOR,Seg. Ambulatorial,HCO,HSO,REF,SEM VALOR,SEM VALOR,REABILITAÇÃO,PROCEDIMENTOS CLÍNICOS AMBULATORIAIS E HOSPITALARES,PROCEDIMENTOS CLÍNICOS AMBULATORIAIS E HOSPITALARES
REEDUACAÇÃO E REABILITAÇÃO DE QUEIMADOS PARA PREVENÇÃO DE SEQUELAS,SEM VALOR,SEM VALOR,SEM VALOR,Seg. Ambulatorial,HCO,HSO,REF,SEM VALOR,SEM VALOR,REABILITAÇÃO,PROCEDIMENTOS CLÍNICOS AMBULATORIAIS E HOSPITALARES,PROCEDIMENTOS CLÍNICOS AMBULATORIAIS E HOSPITALARES
REEDUCAÇÃO E REABILITAÇÃO CARDIOVASCULAR,SEM VALOR,SEM VALOR,SEM VALOR,Seg. Ambulatorial,HCO,HSO,REF,SEM VALOR,SEM VALOR,REABILITAÇÃO,PROCEDIMENTOS CLÍNICOS AMBULATORIAIS E HOSPITALARES,PROCEDIMENTOS CLÍNICOS AMBULATORIAIS E HOSPITALARES
REEDUCAÇÃO E REABILITAÇÃO DO SISTEMA LINFÁTICO E/OU VASCULAR PERIFÉRICO,SEM VALOR,SEM VALOR,SEM VALOR,Seg. Ambulatorial,HCO,HSO,REF,SEM VALOR,SEM VALOR,REABILITAÇÃO,PROCEDIMENTOS CLÍNICOS AMBULATORIAIS E HOSPITALARES,PROCEDIMENTOS CLÍNICOS AMBULATORIAIS E HOSPITALARES
REEDUCAÇÃO E REABILITAÇÃO DO SISTEMA MÚSCULO-ESQUELÉTICO POR DISTÚRBIOS CONGÊNITOS OU REUMÁTICOS,SEM VALOR,SEM VALOR,SEM VALOR,Seg. Ambulatorial,HCO,HSO,REF,SEM VALOR,SEM VALOR,REABILITAÇÃO,PROCEDIMENTOS CLÍNICOS AMBULATORIAIS E HOSPITALARES,PROCEDIMENTOS CLÍNICOS AMBULATORIAIS E HOSPITALARES
REEDUCAÇÃO E REABILITAÇÃO NEUROLÓGICA,SEM VALOR,SEM VALOR,SEM VALOR,Seg. Ambulatorial,HCO,HSO,REF,SEM VALOR,SEM VALOR,REABILITAÇÃO,PROCEDIMENTOS CLÍNICOS AMBULATORIAIS E HOSPITALARES,PROCEDIMENTOS CLÍNICOS AMBULATORIAIS E HOSPITALARES
REEDUCAÇÃO E REABILITAÇÃO NEURO-MÚSCULO-ESQUELÉTICA,SEM VALOR,SEM VALOR,SEM VALOR,Seg. Ambulatorial,HCO,HSO,REF,SEM VALOR,SEM VALOR,REABILITAÇÃO,PROCEDIMENTOS CLÍNICOS AMBULATORIAIS E HOSPITALARES,PROCEDIMENTOS CLÍNICOS AMBULATORIAIS E HOSPITALARES
REEDUCAÇÃO E REABILITAÇÃO NO RETARDO DO DESENVOLVIMENTO PSICOMOTOR,SEM VALOR,SEM VALOR,SEM VALOR,Seg. Ambulatorial,HCO,HSO,REF,SEM VALOR,SEM VALOR,REABILITAÇÃO,PROCEDIMENTOS CLÍNICOS AMBULATORIAIS E HOSPITALARES,PROCEDIMENTOS CLÍNICOS AMBULATORIAIS E HOSPITALARES
REEDUCAÇÃO E REABILITAÇÃO RESPIRATÓRIA,SEM VALOR,SEM VALOR,SEM VALOR,Seg. Ambulatorial,HCO,HSO,REF,SEM VALOR,SEM VALOR,REABILITAÇÃO,PROCEDIMENTOS CLÍNICOS AMBULATORIAIS E HOSPITALARES,PROCEDIMENTOS CLÍNICOS AMBULATORIAIS E HOSPITALARES
REEDUCAÇÃO E REABILITAÇÃO TRAUMATO-ORTOPÉDICA (EXCLUI TÉCNICAS CINESIOTERÁPICAS ESPECÍFICAS),SEM VALOR,SEM VALOR,SEM VALOR,Seg. Ambulatorial,HCO,HSO,REF,SEM VALOR,SEM VALOR,REABILITAÇÃO,PROCEDIMENTOS CLÍNICOS AMBULATORIAIS E HOSPITALARES,PROCEDIMENTOS CLÍNICOS AMBULATORIAIS E HOSPITALARES
REEDUCAÇÃO E/OU REABILITAÇÃO DE DISTÚRBIOS CRÂNIO-FACIAIS,SEM VALOR,SEM VALOR,SEM VALOR,Seg. Ambulatorial,HCO,HSO,REF,SEM VALOR,SEM VALOR,REABILITAÇÃO,PROCEDIMENTOS CLÍNICOS AMBULATORIAIS E HOSPITALARES,PROCEDIMENTOS CLÍNICOS AMBULATORIAIS E HOSPITALARES
REEDUCAÇÃO E/OU REABILITAÇÃO NOS PROCESSOS INFLAMATÓRIOS PÉLVICOS,SEM VALOR,SEM VALOR,SEM VALOR,Seg. Ambulatorial,HCO,HSO,REF,SEM VALOR,SEM VALOR,REABILITAÇÃO,PROCEDIMENTOS CLÍNICOS AMBULATORIAIS E HOSPITALARES,PROCEDIMENTOS CLÍNICOS AMBULATORIAIS E HOSPITALARES
ACTINOTERAPIA,SEM VALOR,SEM VALOR,SEM VALOR,Seg. Ambulatorial,HCO,HSO,REF,SEM VALOR,SEM VALOR,TERAPÊUTICA,PROCEDIMENTOS CLÍNICOS AMBULATORIAIS E HOSPITALARES,PROCEDIMENTOS CLÍNICOS AMBULATORIAIS E HOSPITALARES
APLICAÇÃO DE CARIOSTÁTICO (COM DIRETRIZ DE UTILIZAÇÃO),SEM VALOR,SEM VALOR,Seg. Odontológica,SEM VALOR,SEM VALOR,SEM VALOR,SEM VALOR,SEM VALOR,79,TERAPÊUTICA,PROCEDIMENTOS CLÍNICOS AMBULATORIAIS E HOSPITALARES,PROCEDIMENTOS CLÍNICOS AMBULATORIAIS E HOSPITALARES
APLICAÇÃO DE HIPOSSENSIBILIZANTE,SEM VALOR,SEM VALOR,SEM VALOR,Seg. Ambulatorial,HCO,HSO,REF,SEM VALOR,SEM VALOR,TERAPÊUTICA,PROCEDIMENTOS CLÍNICOS AMBULATORIAIS E HOSPITALARES,PROCEDIMENTOS CLÍNICOS AMBULATORIAIS E HOSPITALARES
APLICAÇÃO DE SELANTE (COM DIRETRIZ DE UTILIZAÇÃO),SEM VALOR,SEM VALOR,Seg. Odontológica,SEM VALOR,SEM VALOR,SEM VALOR,SEM VALOR,SEM VALOR,80,TERAPÊUTICA,PROCEDIMENTOS CLÍNICOS AMBULATORIAIS E HOSPITALARES,PROCEDIMENTOS CLÍNICOS AMBULATORIAIS E HOSPITALARES
APLICAÇÃO TÓPICA DE FLÚOR,SEM VALOR,SEM VALOR,Seg. Odontológica,SEM VALOR,SEM VALOR,SEM VALOR,SEM VALOR,SEM VALOR,SEM VALOR,TERAPÊUTICA,PROCEDIMENTOS CLÍNICOS AMBULATORIAIS E HOSPITALARES,PROCEDIMENTOS CLÍNICOS AMBULATORIAIS E HOSPITALARES
APLICAÇÃO TÓPICA DE VERNIZ FLUORETADO,SEM VALOR,SEM VALOR,Seg. Odontológica,SEM VALOR,SEM VALOR,SEM VALOR,SEM VALOR,SEM VALOR,SEM VALOR,TERAPÊUTICA,PROCEDIMENTOS CLÍNICOS AMBULATORIAIS E HOSPITALARES,PROCEDIMENTOS CLÍNICOS AMBULATORIAIS E HOSPITALARES
PROCEDIMENTO,RN (alteração),VIGÊNCIA,Seg. Odontológica,Seg. Ambulatorial,HCO,HSO,REF,PAC,DUT,SUBGRUPO,GRUPO,CAPÍTULO
BETATERAPIA,SEM VALOR,SEM VALOR,SEM VALOR,Seg. Ambulatorial,HCO,HSO,REF,PAC,SEM VALOR,TERAPÊUTICA,PROCEDIMENTOS CLÍNICOS AMBULATORIAIS E HOSPITALARES,PROCEDIMENTOS CLÍNICOS AMBULATORIAIS E HOSPITALARES
CARDIOVERSÃO QUÍMICA DE ARRITMIA PAROXÍSTA,SEM VALOR,SEM VALOR,SEM VALOR,Seg. Ambulatorial,HCO,HSO,REF,SEM VALOR,SEM VALOR,TERAPÊUTICA,PROCEDIMENTOS CLÍNICOS AMBULATORIAIS E HOSPITALARES,PROCEDIMENTOS CLÍNICOS AMBULATORIAIS E HOSPITALARES
CATETERISMO VESICAL,SEM VALOR,SEM VALOR,SEM VALOR,Seg. Ambulatorial,HCO,HSO,REF,SEM VALOR,SEM VALOR,TERAPÊUTICA,PROCEDIMENTOS CLÍNICOS AMBULATORIAIS E HOSPITALARES,PROCEDIMENTOS CLÍNICOS AMBULATORIAIS E HOSPITALARES
CERUMEN - REMOÇÃO,SEM VALOR,SEM VALOR,SEM VALOR,Seg. Ambulatorial,HCO,HSO,REF,SEM VALOR,SEM VALOR,TERAPÊUTICA,PROCEDIMENTOS CLÍNICOS AMBULATORIAIS E HOSPITALARES,PROCEDIMENTOS CLÍNICOS AMBULATORIAIS E HOSPITALARES
CRIOTERAPIA,SEM VALOR,SEM VALOR,SEM VALOR,Seg. Ambulatorial,HCO,HSO,REF,SEM VALOR,SEM VALOR,TERAPÊUTICA,PROCEDIMENTOS CLÍNICOS AMBULATORIAIS E HOSPITALARES,PROCEDIMENTOS CLÍNICOS AMBULATORIAIS E HOSPITALARES
CURATIVOS EM GERAL COM OU SEM ANESTESIA,SEM VALOR,SEM VALOR,SEM VALOR,Seg. Ambulatorial,HCO,HSO,REF,SEM VALOR,SEM VALOR,TERAPÊUTICA,PROCEDIMENTOS CLÍNICOS AMBULATORIAIS E HOSPITALARES,PROCEDIMENTOS CLÍNICOS AMBULATORIAIS E HOSPITALARES
DILATAÇÃO URETRAL,SEM VALOR,SEM VALOR,SEM VALOR,Seg. Ambulatorial,HCO,HSO,REF,SEM VALOR,SEM VALOR,TERAPÊUTICA,PROCEDIMENTOS CLÍNICOS AMBULATORIAIS E HOSPITALARES,PROCEDIMENTOS CLÍNICOS AMBULATORIAIS E HOSPITALARES
DESSENSIBILIZAÇÃO DENTÁRIA,SEM VALOR,SEM VALOR,Seg. Odontológica,SEM VALOR,SEM VALOR,SEM VALOR,SEM VALOR,SEM VALOR,SEM VALOR,TERAPÊUTICA,PROCEDIMENTOS CLÍNICOS AMBULATORIAIS E HOSPITALARES,PROCEDIMENTOS CLÍNICOS AMBULATORIAIS E HOSPITALARES
ESTIMULAÇÃO ELÉTRICA TRANSCUTÂNEA (COM DIRETRIZ DE UTILIZAÇÃO),SEM VALOR,SEM VALOR,SEM VALOR,Seg. Ambulatorial,HCO,HSO,REF,SEM VALOR,24,TERAPÊUTICA,PROCEDIMENTOS CLÍNICOS AMBULATORIAIS E HOSPITALARES,PROCEDIMENTOS CLÍNICOS AMBULATORIAIS E HOSPITALARES
FOTOTERAPIA COM UVA (PUVA) PARA TRATAMENTO DE PSORÍASE OU VITILIGO,SEM VALOR,SEM VALOR,SEM VALOR,Seg. Ambulatorial,SEM VALOR,SEM VALOR,REF,PAC,SEM VALOR,TERAPÊUTICA,PROCEDIMENTOS CLÍNICOS AMBULATORIAIS E HOSPITALARES,PROCEDIMENTOS CLÍNICOS AMBULATORIAIS E HOSPITALARES
INSTILAÇÃO VESICAL OU URETRAL,SEM VALOR,SEM VALOR,SEM VALOR,Seg. Ambulatorial,HCO,HSO,REF,SEM VALOR,SEM VALOR,TERAPÊUTICA,PROCEDIMENTOS CLÍNICOS AMBULATORIAIS E HOSPITALARES,PROCEDIMENTOS CLÍNICOS AMBULATORIAIS E HOSPITALARES
LESÕES MÚSCULO TENDINOSAS - TRATAMENTO INCRUENTO,SEM VALOR,SEM VALOR,SEM VALOR,Seg. Ambulatorial,HCO,HSO,REF,SEM VALOR,SEM VALOR,TERAPÊUTICA,PROCEDIMENTOS CLÍNICOS AMBULATORIAIS E HOSPITALARES,PROCEDIMENTOS CLÍNICOS AMBULATORIAIS E HOSPITALARES
PLANEJAMENTO TÉCNICO DA IMUNOTERAPIA ALÉRGENO INESPECÍFICA,SEM VALOR,SEM VALOR,SEM VALOR,Seg. Ambulatorial,HCO,HSO,REF,SEM VALOR,SEM VALOR,TERAPÊUTICA,PROCEDIMENTOS CLÍNICOS AMBULATORIAIS E HOSPITALARES,PROCEDIMENTOS CLÍNICOS AMBULATORIAIS E HOSPITALARES
PLANEJAMENTO TÉCNICO DA IMUNOTERAPIA ALÉRGENO-ESPECÍFICA,SEM VALOR,SEM VALOR,SEM VALOR,Seg. Ambulatorial,HCO,HSO,REF,SEM VALOR,SEM VALOR,TERAPÊUTICA,PROCEDIMENTOS CLÍNICOS AMBULATORIAIS E HOSPITALARES,PROCEDIMENTOS CLÍNICOS AMBULATORIAIS E HOSPITALARES
PRIAPISMO - TRATAMENTO NÃO CIRÚRGICO,SEM VALOR,SEM VALOR,SEM VALOR,Seg. Ambulatorial,HCO,HSO,REF,SEM VALOR,SEM VALOR,TERAPÊUTICA,PROCEDIMENTOS CLÍNICOS AMBULATORIAIS E HOSPITALARES,PROCEDIMENTOS CLÍNICOS AMBULATORIAIS E HOSPITALARES
PULSOTERAPIA,SEM VALOR,SEM VALOR,SEM VALOR,Seg. Ambulatorial,HCO,HSO,REF,SEM VALOR,SEM VALOR,TERAPÊUTICA,PROCEDIMENTOS CLÍNICOS AMBULATORIAIS E HOSPITALARES,PROCEDIMENTOS CLÍNICOS AMBULATORIAIS E HOSPITALARES
OXIGENOTERAPIA HIPERBÁRICA (COM DIRETRIZ DE UTILIZAÇÃO),SEM VALOR,SEM VALOR,SEM VALOR,SEM VALOR,HCO,HSO,REF,PAC,58,TERAPÊUTICA,PROCEDIMENTOS CLÍNICOS AMBULATORIAIS E HOSPITALARES,PROCEDIMENTOS CLÍNICOS AMBULATORIAIS E HOSPITALARES
REDUÇÃO DE LUXAÇÃO DA ATM (COM DIRETRIZ DE UTILIZAÇÃO),SEM VALOR,SEM VALOR,Seg. Odontológica,Seg. Ambulatorial,HCO,HSO,REF,SEM VALOR,96,TERAPÊUTICA,PROCEDIMENTOS CLÍNICOS AMBULATORIAIS E HOSPITALARES,PROCEDIMENTOS CLÍNICOS AMBULATORIAIS E HOSPITALARES
REMINERALIZAÇÃO DENTÁRIA,SEM VALOR,SEM VALOR,Seg. Odontológica,SEM VALOR,SEM VALOR,SEM VALOR,SEM VALOR,SEM VALOR,SEM VALOR,TERAPÊUTICA,PROCEDIMENTOS CLÍNICOS AMBULATORIAIS E HOSPITALARES,PROCEDIMENTOS CLÍNICOS AMBULATORIAIS E HOSPITALARES
PROCEDIMENTO,RN (alteração),VIGÊNCIA,Seg. Odontológica,Seg. Ambulatorial,HCO,HSO,REF,PAC,DUT,SUBGRUPO,GRUPO,CAPÍTULO
SESSÃO DE ACUPUNTURA,SEM VALOR,SEM VALOR,SEM VALOR,Seg. Ambulatorial,SEM VALOR,SEM VALOR,REF,SEM VALOR,SEM VALOR,TERAPÊUTICA,PROCEDIMENTOS CLÍNICOS AMBULATORIAIS E HOSPITALARES,PROCEDIMENTOS CLÍNICOS AMBULATORIAIS E HOSPITALARES
TERAPIA AVANÇADA PARA O TRATAMENTO DA ATROFIA MUSCULAR ESPINHAL (COM DIRETRIZ DE UTILIZAÇÃO),571/2023,10/02/2023,SEM VALOR,SEM VALOR,HCO,HSO,REF,PAC,159,TERAPÊUTICA,PROCEDIMENTOS CLÍNICOS AMBULATORIAIS E HOSPITALARES,PROCEDIMENTOS CLÍNICOS AMBULATORIAIS E HOSPITALARES
